{
  "$schema": "./encounter-document.schema-1.0.0.json",
  "documentType": "open-triage.encounter",
  "modelVersion": "1.1.0",
  "dataModel": {
    "standard": "NEMSIS",
    "version": "3.5.1",
    "dataset": "EMSDataSet"
  },
  "formProfile": {
    "id": "standard-encounter-v1",
    "version": "1"
  },
  "encounter": {
    "id": "455d8423-412f-4c96-9ad5-b485c6a9506b",
    "createdAt": "2026-08-15T09:14:05-04:00",
    "updatedAt": "2026-08-15T09:14:05-04:00",
    "synthetic": true
  },
  "groups": [
    {
      "id": "EMSDataSet",
      "instances": [
        {
          "instanceId": "synthetic-dataset-1",
          "elements": []
        }
      ]
    },
    {
      "id": "HeaderGroup",
      "instances": [
        {
          "instanceId": "synthetic-header-1",
          "parentInstanceId": "synthetic-dataset-1",
          "elements": []
        }
      ]
    },
    {
      "id": "PatientCareReportGroup",
      "instances": [
        {
          "instanceId": "synthetic-pcr-1",
          "parentInstanceId": "synthetic-header-1",
          "elements": []
        }
      ]
    },
    {
      "id": "eResponseSection",
      "instances": [
        {
          "instanceId": "synthetic-response-1",
          "parentInstanceId": "synthetic-pcr-1",
          "elements": [
            {
              "id": "eResponse.03",
              "values": [
                {
                  "kind": "scalar",
                  "occurrenceId": "synthetic-incident-number",
                  "value": "SYN-20260903-001"
                }
              ]
            },
            {
              "id": "eResponse.04",
              "values": [
                {
                  "kind": "scalar",
                  "occurrenceId": "synthetic-response-number",
                  "value": "SYN-20260903-001-1"
                }
              ]
            },
            {
              "id": "eResponse.13",
              "values": [
                {
                  "kind": "scalar",
                  "occurrenceId": "synthetic-vehicle-number",
                  "value": "SYNTHETIC-VEHICLE-7"
                }
              ]
            },
            {
              "id": "eResponse.14",
              "values": [
                {
                  "kind": "scalar",
                  "occurrenceId": "synthetic-call-sign",
                  "value": "SYNTHETIC-MEDIC-7"
                }
              ]
            }
          ]
        }
      ]
    },
    {
      "id": "eDispatchSection",
      "instances": [
        {
          "instanceId": "synthetic-dispatch-1",
          "parentInstanceId": "synthetic-pcr-1",
          "elements": [
            {
              "id": "eDispatch.01",
              "values": [
                {
                  "kind": "coded",
                  "occurrenceId": "synthetic-dispatch-reason",
                  "code": "2301021",
                  "display": "Chest Pain (Non-Traumatic)"
                }
              ]
            },
            {
              "id": "eDispatch.05",
              "values": [
                {
                  "kind": "coded",
                  "occurrenceId": "synthetic-dispatch-priority",
                  "code": "2305003",
                  "display": "Emergent"
                }
              ]
            }
          ]
        }
      ]
    },
    {
      "id": "eTimesSection",
      "instances": [
        {
          "instanceId": "synthetic-times-1",
          "parentInstanceId": "synthetic-pcr-1",
          "elements": [
            {
              "id": "eTimes.02",
              "values": [
                {
                  "kind": "scalar",
                  "occurrenceId": "synthetic-time-dispatch-notified",
                  "value": "2026-08-15T09:13:52-04:00"
                }
              ]
            },
            {
              "id": "eTimes.03",
              "values": [
                {
                  "kind": "scalar",
                  "occurrenceId": "synthetic-time-unit-notified",
                  "value": "2026-08-15T09:14:00-04:00"
                }
              ]
            }
          ]
        }
      ]
    },
    {
      "id": "ePatientSection",
      "instances": [
        {
          "instanceId": "synthetic-patient-1",
          "parentInstanceId": "synthetic-pcr-1",
          "elements": [
            {
              "id": "ePatient.01",
              "values": [
                {
                  "kind": "scalar",
                  "occurrenceId": "synthetic-patient-id",
                  "value": "200207252388"
                }
              ]
            },
            {
              "id": "ePatient.17",
              "values": [
                {
                  "kind": "scalar",
                  "occurrenceId": "synthetic-patient-dob",
                  "value": "2002-07-25"
                }
              ]
            },
            {
              "id": "ePatient.25",
              "values": [
                {
                  "kind": "coded",
                  "occurrenceId": "synthetic-patient-sex",
                  "code": "9919001",
                  "display": "Female"
                }
              ]
            },
            {
              "id": "ePatient.18",
              "values": [
                {
                  "kind": "scalar",
                  "occurrenceId": "synthetic-phone-mobile",
                  "value": "+46 70 000 00 01",
                  "attributes": {
                    "PhoneNumberType": "9913005"
                  }
                }
              ]
            },
            {
              "id": "ePatient.05",
              "values": [
                {
                  "kind": "scalar",
                  "occurrenceId": "synthetic-ePatient.05",
                  "value": "Lärkstigen 12"
                }
              ]
            },
            {
              "id": "ePatient.09",
              "values": [
                {
                  "kind": "scalar",
                  "occurrenceId": "synthetic-ePatient.09",
                  "value": "75311"
                }
              ]
            },
            {
              "id": "ePatient.19",
              "values": [
                {
                  "kind": "scalar",
                  "occurrenceId": "synthetic-ePatient.19",
                  "value": "andrea.lindqvist@example.org"
                }
              ]
            }
          ]
        }
      ]
    },
    {
      "id": "ePatient.PatientNameGroup",
      "instances": [
        {
          "instanceId": "synthetic-patient-name-1",
          "parentInstanceId": "synthetic-patient-1",
          "elements": [
            {
              "id": "ePatient.02",
              "values": [
                {
                  "kind": "scalar",
                  "occurrenceId": "synthetic-patient-last-name",
                  "value": "Lindqvist"
                }
              ]
            },
            {
              "id": "ePatient.03",
              "values": [
                {
                  "kind": "scalar",
                  "occurrenceId": "synthetic-patient-first-name",
                  "value": "Andrea"
                }
              ]
            }
          ]
        }
      ]
    },
    {
      "id": "eSceneSection",
      "instances": [
        {
          "instanceId": "synthetic-scene-1",
          "parentInstanceId": "synthetic-pcr-1",
          "elements": [
            {
              "id": "eScene.11",
              "values": [
                {
                  "kind": "scalar",
                  "occurrenceId": "synthetic-scene-gps",
                  "value": "40.750600,-73.997200"
                }
              ]
            },
            {
              "id": "eScene.15",
              "values": [
                {
                  "kind": "scalar",
                  "occurrenceId": "synthetic-scene-street",
                  "value": "100 SYNTHETIC CHEST PAIN WAY"
                }
              ]
            },
            {
              "id": "eScene.16",
              "values": [
                {
                  "kind": "scalar",
                  "occurrenceId": "synthetic-scene-apartment",
                  "value": "UNIT SYN-01"
                }
              ]
            },
            {
              "id": "eScene.18",
              "values": [
                {
                  "kind": "coded",
                  "occurrenceId": "synthetic-scene-state",
                  "code": "36",
                  "system": "ANSI-STATE",
                  "display": "New York"
                }
              ]
            },
            {
              "id": "eScene.19",
              "values": [
                {
                  "kind": "scalar",
                  "occurrenceId": "synthetic-scene-zip",
                  "value": "10001"
                }
              ]
            },
            {
              "id": "eScene.21",
              "values": [
                {
                  "kind": "coded",
                  "occurrenceId": "synthetic-scene-county",
                  "code": "36061",
                  "system": "ANSI-COUNTY",
                  "display": "New York County, NY"
                }
              ]
            }
          ]
        }
      ]
    },
    {
      "id": "eCrew.CrewGroup",
      "instances": [
        {
          "instanceId": "SYNTHETIC-SOURCE-RECORD-0001:demo-crew",
          "elements": [
            {
              "id": "eCrew.01",
              "values": [
                {
                  "kind": "scalar",
                  "occurrenceId": "SYNTHETIC-SOURCE-RECORD-0001:demo-crew-member",
                  "value": "SYNTHETIC-MEDIC-7"
                }
              ]
            }
          ]
        }
      ]
    }
  ]
}
